alignment_status,frame,full_context,full_context_token_count,intervention_anchor,lead_subjects,lemma,n_leads,priming_text,probe_form_token_count,probe_form_token_ids,probe_form_token_pieces,probe_subject,probe_subject_animacy,probe_surface,probe_text,probe_token_count,row_id,stem_index,tokenizer_model,verb_final_tok_idx,coord_0_raw,coord_0_calibrated,projection_norm,residual_norm,projection_norm_frac
aligned,T-,"In the lab, the rope bipumed. During the check, the artist bipumed. After the visit, the door bipumed. Tomorrow, the paper will bipum",34,verb_final_subtoken,"[{'animacy': 'inanimate', 'object': '', 'subject': 'rope'}, {'animacy': 'animate', 'object': '', 'subject': 'artist'}, {'animacy': 'inanimate', 'object': '', 'subject': 'door'}]",bipum,3,"In the lab, the rope bipumed. During the check, the artist bipumed. After the visit, the door bipumed.",2,"[15086, 360]","['Ġbip', 'um']",paper,inanimate, bipum,"Tomorrow, the paper will bipum",7,nonce|0008|bipum|T-,8,EleutherAI/pythia-1.4b,33,-2.8839240074157715,2.8839240074157715,2.8839242458343506,117.20112609863281,0.024606625736747018
aligned,T-,"In the lab, the rope tobived. During the check, the artist tobived. After the visit, the door tobived. Tomorrow, the paper will tobiv",34,verb_final_subtoken,"[{'animacy': 'inanimate', 'object': '', 'subject': 'rope'}, {'animacy': 'animate', 'object': '', 'subject': 'artist'}, {'animacy': 'inanimate', 'object': '', 'subject': 'door'}]",tobiv,3,"In the lab, the rope tobived. During the check, the artist tobived. After the visit, the door tobived.",2,"[15485, 400]","['Ġtob', 'iv']",paper,inanimate, tobiv,"Tomorrow, the paper will tobiv",7,nonce|0009|tobiv|T-,9,EleutherAI/pythia-1.4b,33,0.7416224479675293,-0.7416224479675293,0.7416225075721741,101.0911636352539,0.007336175397565067
aligned,T-,"In the lab, the rope vidived. During the check, the artist vidived. After the visit, the door vidived. Tomorrow, the shirt will vidiv",34,verb_final_subtoken,"[{'animacy': 'inanimate', 'object': '', 'subject': 'rope'}, {'animacy': 'animate', 'object': '', 'subject': 'artist'}, {'animacy': 'inanimate', 'object': '', 'subject': 'door'}]",vidiv,3,"In the lab, the rope vidived. During the check, the artist vidived. After the visit, the door vidived.",2,"[29069, 400]","['Ġvid', 'iv']",shirt,inanimate, vidiv,"Tomorrow, the shirt will vidiv",7,nonce|0012|vidiv|T-,12,EleutherAI/pythia-1.4b,33,-0.6776033639907837,0.6776033639907837,0.6776034235954285,115.61200714111328,0.00586101253971278
aligned,T-,"In the lab, the door texomed. During the check, the worker texomed. After the visit, the glass texomed. Tomorrow, the paper will texom",34,verb_final_subtoken,"[{'animacy': 'inanimate', 'object': '', 'subject': 'door'}, {'animacy': 'animate', 'object': '', 'subject': 'worker'}, {'animacy': 'inanimate', 'object': '', 'subject': 'glass'}]",texom,3,"In the lab, the door texomed. During the check, the worker texomed. After the visit, the glass texomed.",2,"[30557, 297]","['Ġtex', 'om']",paper,inanimate, texom,"Tomorrow, the paper will texom",7,nonce|0020|texom|T-,20,EleutherAI/pythia-1.4b,33,-0.0010745227336883545,0.0010745227336883545,0.0010745228501036763,109.16510009765625,9.843098656461051e-06
aligned,T-,"In the lab, the glass vezoped. During the check, the teacher vezoped. After the visit, the rope vezoped. Tomorrow, the chef will vezop",34,verb_final_subtoken,"[{'animacy': 'inanimate', 'object': '', 'subject': 'glass'}, {'animacy': 'animate', 'object': '', 'subject': 'teacher'}, {'animacy': 'inanimate', 'object': '', 'subject': 'rope'}]",vezop,3,"In the lab, the glass vezoped. During the check, the teacher vezoped. After the visit, the rope vezoped.",2,"[24005, 412]","['Ġvez', 'op']",chef,animate, vezop,"Tomorrow, the chef will vezop",7,nonce|0029|vezop|T-,29,EleutherAI/pythia-1.4b,33,-6.12877893447876,6.12877893447876,6.128779411315918,136.2281036376953,0.04498909731295738
aligned,T-,"In the lab, the door sugoped. During the check, the worker sugoped. After the visit, the glass sugoped. Tomorrow, the driver will sugop",34,verb_final_subtoken,"[{'animacy': 'inanimate', 'object': '', 'subject': 'door'}, {'animacy': 'animate', 'object': '', 'subject': 'worker'}, {'animacy': 'inanimate', 'object': '', 'subject': 'glass'}]",sugop,3,"In the lab, the door sugoped. During the check, the worker sugoped. After the visit, the glass sugoped.",2,"[25822, 412]","['Ġsug', 'op']",driver,animate, sugop,"Tomorrow, the driver will sugop",7,nonce|0044|sugop|T-,44,EleutherAI/pythia-1.4b,33,-4.434208393096924,4.434208393096924,4.434208869934082,114.25032806396484,0.03881134474687478
aligned,T-,"In the lab, the door vigeted. During the check, the worker vigeted. After the visit, the glass vigeted. Tomorrow, the shirt will viget",34,verb_final_subtoken,"[{'animacy': 'inanimate', 'object': '', 'subject': 'door'}, {'animacy': 'animate', 'object': '', 'subject': 'worker'}, {'animacy': 'inanimate', 'object': '', 'subject': 'glass'}]",viget,3,"In the lab, the door vigeted. During the check, the worker vigeted. After the visit, the glass vigeted.",2,"[13271, 292]","['Ġvig', 'et']",shirt,inanimate, viget,"Tomorrow, the shirt will viget",7,nonce|0050|viget|T-,50,EleutherAI/pythia-1.4b,33,3.4278504848480225,-3.4278504848480225,3.4278507232666016,150.0605926513672,0.02284311065750926
aligned,T-,"In the lab, the glass fifumed. During the check, the teacher fifumed. After the visit, the rope fifumed. Tomorrow, the driver will fifum",34,verb_final_subtoken,"[{'animacy': 'inanimate', 'object': '', 'subject': 'glass'}, {'animacy': 'animate', 'object': '', 'subject': 'teacher'}, {'animacy': 'inanimate', 'object': '', 'subject': 'rope'}]",fifum,3,"In the lab, the glass fifumed. During the check, the teacher fifumed. After the visit, the rope fifumed.",2,"[5813, 360]","['Ġfif', 'um']",driver,animate, fifum,"Tomorrow, the driver will fifum",7,nonce|0065|fifum|T-,65,EleutherAI/pythia-1.4b,33,-5.632277488708496,5.632277488708496,5.632277965545654,121.0123062133789,0.04654301815894952
aligned,T-,"In the lab, the glass bifumed. During the check, the teacher bifumed. After the visit, the rope bifumed. Tomorrow, the shirt will bifum",34,verb_final_subtoken,"[{'animacy': 'inanimate', 'object': '', 'subject': 'glass'}, {'animacy': 'animate', 'object': '', 'subject': 'teacher'}, {'animacy': 'inanimate', 'object': '', 'subject': 'rope'}]",bifum,3,"In the lab, the glass bifumed. During the check, the teacher bifumed. After the visit, the rope bifumed.",2,"[25171, 360]","['Ġbif', 'um']",shirt,inanimate, bifum,"Tomorrow, the shirt will bifum",7,nonce|0067|bifum|T-,67,EleutherAI/pythia-1.4b,33,-2.1638338565826416,2.1638338565826416,2.1638340950012207,115.76693725585938,0.01869129603229355
aligned,T-,"In the lab, the worker dizoped. During the check, the glass dizoped. After the visit, the teacher dizoped. Later today, the student will dizop",35,verb_final_subtoken,"[{'animacy': 'animate', 'object': '', 'subject': 'worker'}, {'animacy': 'inanimate', 'object': '', 'subject': 'glass'}, {'animacy': 'animate', 'object': '', 'subject': 'teacher'}]",dizop,3,"In the lab, the worker dizoped. During the check, the glass dizoped. After the visit, the teacher dizoped.",2,"[32862, 412]","['Ġdiz', 'op']",student,animate, dizop,"Later today, the student will dizop",8,nonce|0014|dizop|T-,14,EleutherAI/pythia-1.4b,34,-3.7934536933898926,3.7934536933898926,3.7934539318084717,120.96957397460938,0.03135874424592658
aligned,T-,"In the lab, the door bufumed. During the check, the worker bufumed. After the visit, the glass bufumed. Later today, the student will bufum",35,verb_final_subtoken,"[{'animacy': 'inanimate', 'object': '', 'subject': 'door'}, {'animacy': 'animate', 'object': '', 'subject': 'worker'}, {'animacy': 'inanimate', 'object': '', 'subject': 'glass'}]",bufum,3,"In the lab, the door bufumed. During the check, the worker bufumed. After the visit, the glass bufumed.",2,"[15264, 360]","['Ġbuf', 'um']",student,animate, bufum,"Later today, the student will bufum",8,nonce|0031|bufum|T-,31,EleutherAI/pythia-1.4b,34,-2.4489874839782715,2.4489874839782715,2.4489877223968506,133.1938018798828,0.01838664928721986
aligned,T-,"In the lab, the teacher vonoped. During the check, the rope vonoped. After the visit, the artist vonoped. Later today, the shirt will vonop",35,verb_final_subtoken,"[{'animacy': 'animate', 'object': '', 'subject': 'teacher'}, {'animacy': 'inanimate', 'object': '', 'subject': 'rope'}, {'animacy': 'animate', 'object': '', 'subject': 'artist'}]",vonop,3,"In the lab, the teacher vonoped. During the check, the rope vonoped. After the visit, the artist vonoped.",2,"[8449, 412]","['Ġvon', 'op']",shirt,inanimate, vonop,"Later today, the shirt will vonop",8,nonce|0043|vonop|T-,43,EleutherAI/pythia-1.4b,34,-1.739806890487671,1.739806890487671,1.7398070096969604,120.5192642211914,0.01443592458798834
aligned,T-,"In the lab, the worker vizoped. During the check, the glass vizoped. After the visit, the teacher vizoped. Later today, the box will vizop",35,verb_final_subtoken,"[{'animacy': 'animate', 'object': '', 'subject': 'worker'}, {'animacy': 'inanimate', 'object': '', 'subject': 'glass'}, {'animacy': 'animate', 'object': '', 'subject': 'teacher'}]",vizop,3,"In the lab, the worker vizoped. During the check, the glass vizoped. After the visit, the teacher vizoped.",2,"[40027, 412]","['Ġviz', 'op']",box,inanimate, vizop,"Later today, the box will vizop",8,nonce|0045|vizop|T-,45,EleutherAI/pythia-1.4b,34,-1.0717707872390747,1.0717707872390747,1.0717709064483643,115.90595245361328,0.009246901334746356
aligned,T-,"In the lab, the rope vilomed. During the check, the artist vilomed. After the visit, the door vilomed. Later today, the student will vilom",35,verb_final_subtoken,"[{'animacy': 'inanimate', 'object': '', 'subject': 'rope'}, {'animacy': 'animate', 'object': '', 'subject': 'artist'}, {'animacy': 'inanimate', 'object': '', 'subject': 'door'}]",vilom,3,"In the lab, the rope vilomed. During the check, the artist vilomed. After the visit, the door vilomed.",2,"[20442, 297]","['Ġvil', 'om']",student,animate, vilom,"Later today, the student will vilom",8,nonce|0054|vilom|T-,54,EleutherAI/pythia-1.4b,34,-2.044067144393921,2.044067144393921,2.0440673828125,117.61895751953125,0.017378723854724453
aligned,T-,"In the lab, the glass vonened. During the check, the teacher vonened. After the visit, the rope vonened. Later today, the student will vonen",35,verb_final_subtoken,"[{'animacy': 'inanimate', 'object': '', 'subject': 'glass'}, {'animacy': 'animate', 'object': '', 'subject': 'teacher'}, {'animacy': 'inanimate', 'object': '', 'subject': 'rope'}]",vonen,3,"In the lab, the glass vonened. During the check, the teacher vonened. After the visit, the rope vonened.",2,"[8449, 257]","['Ġvon', 'en']",student,animate, vonen,"Later today, the student will vonen",8,nonce|0056|vonen|T-,56,EleutherAI/pythia-1.4b,34,-3.0637364387512207,3.0637364387512207,3.0637366771698,145.2255401611328,0.021096404074451895
aligned,T-,"In the lab, the rope novived. During the check, the artist novived. After the visit, the door novived. During the trial, the paper will noviv",36,verb_final_subtoken,"[{'animacy': 'inanimate', 'object': '', 'subject': 'rope'}, {'animacy': 'animate', 'object': '', 'subject': 'artist'}, {'animacy': 'inanimate', 'object': '', 'subject': 'door'}]",noviv,3,"In the lab, the rope novived. During the check, the artist novived. After the visit, the door novived.",2,"[22458, 400]","['Ġnov', 'iv']",paper,inanimate, noviv,"During the trial, the paper will noviv",9,nonce|0004|noviv|T-,4,EleutherAI/pythia-1.4b,35,1.4324944019317627,-1.4324944019317627,1.4324945211410522,117.96197509765625,0.012143697322422283
aligned,T-,"In the lab, the glass givomed. During the check, the teacher givomed. After the visit, the rope givomed. During the trial, the box will givom",36,verb_final_subtoken,"[{'animacy': 'inanimate', 'object': '', 'subject': 'glass'}, {'animacy': 'animate', 'object': '', 'subject': 'teacher'}, {'animacy': 'inanimate', 'object': '', 'subject': 'rope'}]",givom,3,"In the lab, the glass givomed. During the check, the teacher givomed. After the visit, the rope givomed.",2,"[1259, 297]","['Ġgiv', 'om']",box,inanimate, givom,"During the trial, the box will givom",9,nonce|0021|givom|T-,21,EleutherAI/pythia-1.4b,35,-0.9798785448074341,0.9798785448074341,0.9798786044120789,123.3870620727539,0.007941502033935321
aligned,T-,"In the lab, the door negived. During the check, the worker negived. After the visit, the glass negived. During the trial, the paper will negiv",36,verb_final_subtoken,"[{'animacy': 'inanimate', 'object': '', 'subject': 'door'}, {'animacy': 'animate', 'object': '', 'subject': 'worker'}, {'animacy': 'inanimate', 'object': '', 'subject': 'glass'}]",negiv,3,"In the lab, the door negived. During the check, the worker negived. After the visit, the glass negived.",2,"[2297, 400]","['Ġneg', 'iv']",paper,inanimate, negiv,"During the trial, the paper will negiv",9,nonce|0023|negiv|T-,23,EleutherAI/pythia-1.4b,35,-1.8818902969360352,1.8818902969360352,1.8818904161453247,103.54457092285156,0.01817468940546843
aligned,T-,"In the lab, the teacher vomumed. During the check, the rope vomumed. After the visit, the artist vomumed. During the trial, the driver will vomum",36,verb_final_subtoken,"[{'animacy': 'animate', 'object': '', 'subject': 'teacher'}, {'animacy': 'inanimate', 'object': '', 'subject': 'rope'}, {'animacy': 'animate', 'object': '', 'subject': 'artist'}]",vomum,3,"In the lab, the teacher vomumed. During the check, the rope vomumed. After the visit, the artist vomumed.",2,"[20648, 360]","['Ġvom', 'um']",driver,animate, vomum,"During the trial, the driver will vomum",9,nonce|0030|vomum|T-,30,EleutherAI/pythia-1.4b,35,-5.168889999389648,5.168889999389648,5.168890476226807,147.75381469726562,0.03498312708079586
aligned,T-,"In the lab, the teacher vomomed. During the check, the rope vomomed. After the visit, the artist vomomed. During the trial, the student will vomom",36,verb_final_subtoken,"[{'animacy': 'animate', 'object': '', 'subject': 'teacher'}, {'animacy': 'inanimate', 'object': '', 'subject': 'rope'}, {'animacy': 'animate', 'object': '', 'subject': 'artist'}]",vomom,3,"In the lab, the teacher vomomed. During the check, the rope vomomed. After the visit, the artist vomomed.",2,"[20648, 297]","['Ġvom', 'om']",student,animate, vomom,"During the trial, the student will vomom",9,nonce|0038|vomom|T-,38,EleutherAI/pythia-1.4b,35,-1.195392370223999,1.195392370223999,1.1953924894332886,120.69938659667969,0.009903882058885066
aligned,T-,"In the lab, the glass tekomed. During the check, the teacher tekomed. After the visit, the rope tekomed. During the trial, the chef will tekom",36,verb_final_subtoken,"[{'animacy': 'inanimate', 'object': '', 'subject': 'glass'}, {'animacy': 'animate', 'object': '', 'subject': 'teacher'}, {'animacy': 'inanimate', 'object': '', 'subject': 'rope'}]",tekom,3,"In the lab, the glass tekomed. During the check, the teacher tekomed. After the visit, the rope tekomed.",2,"[716, 21971]","['Ġte', 'kom']",chef,animate, tekom,"During the trial, the chef will tekom",9,nonce|0049|tekom|T-,49,EleutherAI/pythia-1.4b,35,3.5937681198120117,-3.5937681198120117,3.593768358230591,114.91484069824219,0.03127331801875407
aligned,T-,"In the lab, the rope mulomed. During the check, the artist mulomed. After the visit, the door mulomed. During the trial, the chef will mulom",36,verb_final_subtoken,"[{'animacy': 'inanimate', 'object': '', 'subject': 'rope'}, {'animacy': 'animate', 'object': '', 'subject': 'artist'}, {'animacy': 'inanimate', 'object': '', 'subject': 'door'}]",mulom,3,"In the lab, the rope mulomed. During the check, the artist mulomed. After the visit, the door mulomed.",2,"[22871, 297]","['Ġmul', 'om']",chef,animate, mulom,"During the trial, the chef will mulom",9,nonce|0053|mulom|T-,53,EleutherAI/pythia-1.4b,35,-1.1829400062561035,1.1829400062561035,1.182940125465393,135.97833251953125,0.008699475155686892
aligned,T-,"In the lab, the teacher zumumed. During the check, the rope zumumed. After the visit, the artist zumumed. During the trial, the student will zumum",36,verb_final_subtoken,"[{'animacy': 'animate', 'object': '', 'subject': 'teacher'}, {'animacy': 'inanimate', 'object': '', 'subject': 'rope'}, {'animacy': 'animate', 'object': '', 'subject': 'artist'}]",zumum,3,"In the lab, the teacher zumumed. During the check, the rope zumumed. After the visit, the artist zumumed.",2,"[30070, 360]","['Ġzum', 'um']",student,animate, zumum,"During the trial, the student will zumum",9,nonce|0061|zumum|T-,61,EleutherAI/pythia-1.4b,35,4.055511474609375,-4.055511474609375,4.055511951446533,147.11891174316406,0.027566217717315152
aligned,T-,"In the lab, the glass bufened. During the check, the teacher bufened. After the visit, the rope bufened. During the trial, the student will bufen",36,verb_final_subtoken,"[{'animacy': 'inanimate', 'object': '', 'subject': 'glass'}, {'animacy': 'animate', 'object': '', 'subject': 'teacher'}, {'animacy': 'inanimate', 'object': '', 'subject': 'rope'}]",bufen,3,"In the lab, the glass bufened. During the check, the teacher bufened. After the visit, the rope bufened.",2,"[15264, 257]","['Ġbuf', 'en']",student,animate, bufen,"During the trial, the student will bufen",9,nonce|0062|bufen|T-,62,EleutherAI/pythia-1.4b,35,-2.45475435256958,2.45475435256958,2.454754590988159,135.94285583496094,0.018057253365107405
aligned,T-,"In the lab, the door gefled. During the check, the worker gefled. After the visit, the glass gefled. During the trial, the paper will gefle",36,verb_final_subtoken,"[{'animacy': 'inanimate', 'object': '', 'subject': 'door'}, {'animacy': 'animate', 'object': '', 'subject': 'worker'}, {'animacy': 'inanimate', 'object': '', 'subject': 'glass'}]",gefle,3,"In the lab, the door gefled. During the check, the worker gefled. After the visit, the glass gefled.",2,"[41817, 282]","['Ġgef', 'le']",paper,inanimate, gefle,"During the trial, the paper will gefle",9,nonce|0078|gefle|T-,78,EleutherAI/pythia-1.4b,35,-0.8979259729385376,0.8979259729385376,0.8979260325431824,111.80335235595703,0.008031297931786387
aligned,T-,"In the lab, the worker buvived. During the check, the glass buvived. After the visit, the teacher buvived. Tomorrow, the chef will buviv",37,verb_final_subtoken,"[{'animacy': 'animate', 'object': '', 'subject': 'worker'}, {'animacy': 'inanimate', 'object': '', 'subject': 'glass'}, {'animacy': 'animate', 'object': '', 'subject': 'teacher'}]",buviv,3,"In the lab, the worker buvived. During the check, the glass buvived. After the visit, the teacher buvived.",2,"[1081, 40418]","['Ġbu', 'viv']",chef,animate, buviv,"Tomorrow, the chef will buviv",7,nonce|0001|buviv|T-,1,EleutherAI/pythia-1.4b,36,-2.9008371829986572,2.9008371829986572,2.9008374214172363,114.94248962402344,0.025237294153849177
aligned,T-,"In the lab, the artist mexived. During the check, the door mexived. After the visit, the worker mexived. Tomorrow, the driver will mexiv",37,verb_final_subtoken,"[{'animacy': 'animate', 'object': '', 'subject': 'artist'}, {'animacy': 'inanimate', 'object': '', 'subject': 'door'}, {'animacy': 'animate', 'object': '', 'subject': 'worker'}]",mexiv,3,"In the lab, the artist mexived. During the check, the door mexived. After the visit, the worker mexived.",2,"[479, 32693]","['Ġme', 'xiv']",driver,animate, mexiv,"Tomorrow, the driver will mexiv",7,nonce|0002|mexiv|T-,2,EleutherAI/pythia-1.4b,36,1.1382580995559692,-1.1382580995559692,1.1382582187652588,108.15091705322266,0.01052472091572839
aligned,T-,"In the lab, the rope veketed. During the check, the artist veketed. After the visit, the door veketed. Tomorrow, the box will veket",37,verb_final_subtoken,"[{'animacy': 'inanimate', 'object': '', 'subject': 'rope'}, {'animacy': 'animate', 'object': '', 'subject': 'artist'}, {'animacy': 'inanimate', 'object': '', 'subject': 'door'}]",veket,3,"In the lab, the rope veketed. During the check, the artist veketed. After the visit, the door veketed.",2,"[1670, 7151]","['Ġve', 'ket']",box,inanimate, veket,"Tomorrow, the box will veket",7,nonce|0017|veket|T-,17,EleutherAI/pythia-1.4b,36,-0.23200905323028564,0.23200905323028564,0.23200906813144684,147.0557098388672,0.0015776950679825031
aligned,T-,"In the lab, the worker dokiped. During the check, the glass dokiped. After the visit, the teacher dokiped. Tomorrow, the box will dokip",37,verb_final_subtoken,"[{'animacy': 'animate', 'object': '', 'subject': 'worker'}, {'animacy': 'inanimate', 'object': '', 'subject': 'glass'}, {'animacy': 'animate', 'object': '', 'subject': 'teacher'}]",dokip,3,"In the lab, the worker dokiped. During the check, the glass dokiped. After the visit, the teacher dokiped.",2,"[513, 44821]","['Ġdo', 'kip']",box,inanimate, dokip,"Tomorrow, the box will dokip",7,nonce|0018|dokip|T-,18,EleutherAI/pythia-1.4b,36,2.607416868209839,-2.607416868209839,2.607417106628418,152.25657653808594,0.017125152593826975
aligned,T-,"In the lab, the artist voxeved. During the check, the door voxeved. After the visit, the worker voxeved. Tomorrow, the student will voxev",37,verb_final_subtoken,"[{'animacy': 'animate', 'object': '', 'subject': 'artist'}, {'animacy': 'inanimate', 'object': '', 'subject': 'door'}, {'animacy': 'animate', 'object': '', 'subject': 'worker'}]",voxev,3,"In the lab, the artist voxeved. During the check, the door voxeved. After the visit, the worker voxeved.",2,"[32582, 1173]","['Ġvox', 'ev']",student,animate, voxev,"Tomorrow, the student will voxev",7,nonce|0036|voxev|T-,36,EleutherAI/pythia-1.4b,36,-2.1818370819091797,2.1818370819091797,2.1818370819091797,133.7272491455078,0.016315575889362204
aligned,T-,"In the lab, the door toziped. During the check, the worker toziped. After the visit, the glass toziped. Tomorrow, the shirt will tozip",37,verb_final_subtoken,"[{'animacy': 'inanimate', 'object': '', 'subject': 'door'}, {'animacy': 'animate', 'object': '', 'subject': 'worker'}, {'animacy': 'inanimate', 'object': '', 'subject': 'glass'}]",tozip,3,"In the lab, the door toziped. During the check, the worker toziped. After the visit, the glass toziped.",2,"[281, 16368]","['Ġto', 'zip']",shirt,inanimate, tozip,"Tomorrow, the shirt will tozip",7,nonce|0040|tozip|T-,40,EleutherAI/pythia-1.4b,36,6.312926292419434,-6.312926292419434,6.312926769256592,175.309326171875,0.03601021638214122
aligned,T-,"In the lab, the teacher naviped. During the check, the rope naviped. After the visit, the artist naviped. Tomorrow, the box will navip",37,verb_final_subtoken,"[{'animacy': 'animate', 'object': '', 'subject': 'teacher'}, {'animacy': 'inanimate', 'object': '', 'subject': 'rope'}, {'animacy': 'animate', 'object': '', 'subject': 'artist'}]",navip,3,"In the lab, the teacher naviped. During the check, the rope naviped. After the visit, the artist naviped.",2,"[6563, 532]","['Ġnav', 'ip']",box,inanimate, navip,"Tomorrow, the box will navip",7,nonce|0047|navip|T-,47,EleutherAI/pythia-1.4b,36,1.0144034624099731,-1.0144034624099731,1.0144035816192627,122.09190368652344,0.00830852457034162
aligned,T-,"In the lab, the teacher zebled. During the check, the rope zebled. After the visit, the artist zebled. Tomorrow, the driver will zeble",37,verb_final_subtoken,"[{'animacy': 'animate', 'object': '', 'subject': 'teacher'}, {'animacy': 'inanimate', 'object': '', 'subject': 'rope'}, {'animacy': 'animate', 'object': '', 'subject': 'artist'}]",zeble,3,"In the lab, the teacher zebled. During the check, the rope zebled. After the visit, the artist zebled.",2,"[14756, 934]","['Ġze', 'ble']",driver,animate, zeble,"Tomorrow, the driver will zeble",7,nonce|0048|zeble|T-,48,EleutherAI/pythia-1.4b,36,3.2832462787628174,-3.2832462787628174,3.2832465171813965,146.8145751953125,0.022363219134160083
aligned,T-,"In the lab, the rope voocketed. During the check, the artist voocketed. After the visit, the door voocketed. Tomorrow, the chef will voocket",37,verb_final_subtoken,"[{'animacy': 'inanimate', 'object': '', 'subject': 'rope'}, {'animacy': 'animate', 'object': '', 'subject': 'artist'}, {'animacy': 'inanimate', 'object': '', 'subject': 'door'}]",voocket,3,"In the lab, the rope voocketed. During the check, the artist voocketed. After the visit, the door voocketed.",2,"[3273, 5156]","['Ġvo', 'ocket']",chef,animate, voocket,"Tomorrow, the chef will voocket",7,nonce|0051|voocket|T-,51,EleutherAI/pythia-1.4b,36,-3.711973190307617,3.711973190307617,3.7119734287261963,157.93939208984375,0.02350251814705379
aligned,T-,"In the lab, the worker draickened. During the check, the glass draickened. After the visit, the teacher draickened. Tomorrow, the student will draicken",37,verb_final_subtoken,"[{'animacy': 'animate', 'object': '', 'subject': 'worker'}, {'animacy': 'inanimate', 'object': '', 'subject': 'glass'}, {'animacy': 'animate', 'object': '', 'subject': 'teacher'}]",draicken,3,"In the lab, the worker draickened. During the check, the glass draickened. After the visit, the teacher draickened.",2,"[6536, 20471]","['Ġdra', 'icken']",student,animate, draicken,"Tomorrow, the student will draicken",7,nonce|0063|draicken|T-,63,EleutherAI/pythia-1.4b,36,-0.6391348242759705,0.6391348242759705,0.6391348838806152,144.0816192626953,0.004435922410861577
