alignment_status,frame,full_context,full_context_token_count,intervention_anchor,lead_subjects,lemma,n_leads,priming_text,probe_form_token_count,probe_form_token_ids,probe_form_token_pieces,probe_subject,probe_subject_animacy,probe_surface,probe_text,probe_token_count,row_id,stem_index,tokenizer_model,verb_final_tok_idx,coord_0_raw,coord_0_calibrated,projection_norm,residual_norm,projection_norm_frac
aligned,T-,"In the lab, the rope voockiped. During the check, the artist voockiped. After the visit, the door voockiped. During the trial, the driver will voockip",43,verb_final_subtoken,"[{'animacy': 'inanimate', 'object': '', 'subject': 'rope'}, {'animacy': 'animate', 'object': '', 'subject': 'artist'}, {'animacy': 'inanimate', 'object': '', 'subject': 'door'}]",voockip,3,"In the lab, the rope voockiped. During the check, the artist voockiped. After the visit, the door voockiped.",3,"[3273, 825, 532]","['Ġvo', 'ock', 'ip']",driver,animate, voockip,"During the trial, the driver will voockip",10,nonce|0027|voockip|T-,27,EleutherAI/pythia-1.4b,42,1.76627516746521,-1.76627516746521,1.7662752866744995,162.05140686035156,0.010899475178247568
aligned,T+,"In the lab, the door vomumed the vase. During the check, the worker vomumed the box. After the visit, the glass vomumed the cup. During the trial, the driver will vomum",43,verb_final_subtoken,"[{'animacy': 'inanimate', 'object': 'vase', 'subject': 'door'}, {'animacy': 'animate', 'object': 'box', 'subject': 'worker'}, {'animacy': 'inanimate', 'object': 'cup', 'subject': 'glass'}]",vomum,3,"In the lab, the door vomumed the vase. During the check, the worker vomumed the box. After the visit, the glass vomumed the cup.",2,"[20648, 360]","['Ġvom', 'um']",driver,animate, vomum,"During the trial, the driver will vomum",9,nonce|0030|vomum|T+,30,EleutherAI/pythia-1.4b,42,-14.339533805847168,14.339533805847168,14.339534759521484,150.071044921875,0.0955516420038686
aligned,T+,"In the lab, the teacher voxeved the rope. During the check, the rope voxeved the lock. After the visit, the artist voxeved the towel. Tomorrow, the student will voxev",43,verb_final_subtoken,"[{'animacy': 'animate', 'object': 'rope', 'subject': 'teacher'}, {'animacy': 'inanimate', 'object': 'lock', 'subject': 'rope'}, {'animacy': 'animate', 'object': 'towel', 'subject': 'artist'}]",voxev,3,"In the lab, the teacher voxeved the rope. During the check, the rope voxeved the lock. After the visit, the artist voxeved the towel.",2,"[32582, 1173]","['Ġvox', 'ev']",student,animate, voxev,"Tomorrow, the student will voxev",7,nonce|0036|voxev|T+,36,EleutherAI/pythia-1.4b,42,-5.8710150718688965,5.8710150718688965,5.871015548706055,121.75621795654297,0.04821943098463791
aligned,T+,"In the lab, the rope toziped the cup. During the check, the artist toziped the plate. After the visit, the door toziped the toy. Tomorrow, the shirt will tozip",43,verb_final_subtoken,"[{'animacy': 'inanimate', 'object': 'cup', 'subject': 'rope'}, {'animacy': 'animate', 'object': 'plate', 'subject': 'artist'}, {'animacy': 'inanimate', 'object': 'toy', 'subject': 'door'}]",tozip,3,"In the lab, the rope toziped the cup. During the check, the artist toziped the plate. After the visit, the door toziped the toy.",2,"[281, 16368]","['Ġto', 'zip']",shirt,inanimate, tozip,"Tomorrow, the shirt will tozip",7,nonce|0040|tozip|T+,40,EleutherAI/pythia-1.4b,42,-7.152524471282959,7.152524471282959,7.152524948120117,156.2309112548828,0.045781752731705795
aligned,T+,"In the lab, the rope naviped the rope. During the check, the artist naviped the lock. After the visit, the door naviped the towel. Tomorrow, the box will navip",43,verb_final_subtoken,"[{'animacy': 'inanimate', 'object': 'rope', 'subject': 'rope'}, {'animacy': 'animate', 'object': 'lock', 'subject': 'artist'}, {'animacy': 'inanimate', 'object': 'towel', 'subject': 'door'}]",navip,3,"In the lab, the rope naviped the rope. During the check, the artist naviped the lock. After the visit, the door naviped the towel.",2,"[6563, 532]","['Ġnav', 'ip']",box,inanimate, navip,"Tomorrow, the box will navip",7,nonce|0047|navip|T+,47,EleutherAI/pythia-1.4b,42,-6.215131759643555,6.215131759643555,6.215132236480713,119.64445495605469,0.05194668017639034
aligned,T+,"In the lab, the teacher tekomed the vase. During the check, the rope tekomed the box. After the visit, the artist tekomed the cup. During the trial, the chef will tekom",43,verb_final_subtoken,"[{'animacy': 'animate', 'object': 'vase', 'subject': 'teacher'}, {'animacy': 'inanimate', 'object': 'box', 'subject': 'rope'}, {'animacy': 'animate', 'object': 'cup', 'subject': 'artist'}]",tekom,3,"In the lab, the teacher tekomed the vase. During the check, the rope tekomed the box. After the visit, the artist tekomed the cup.",2,"[716, 21971]","['Ġte', 'kom']",chef,animate, tekom,"During the trial, the chef will tekom",9,nonce|0049|tekom|T+,49,EleutherAI/pythia-1.4b,42,-3.162327289581299,3.162327289581299,3.162327527999878,116.00320434570312,0.027260691166562708
aligned,T+,"In the lab, the teacher voocketed the cup. During the check, the rope voocketed the plate. After the visit, the artist voocketed the toy. Tomorrow, the chef will voocket",43,verb_final_subtoken,"[{'animacy': 'animate', 'object': 'cup', 'subject': 'teacher'}, {'animacy': 'inanimate', 'object': 'plate', 'subject': 'rope'}, {'animacy': 'animate', 'object': 'toy', 'subject': 'artist'}]",voocket,3,"In the lab, the teacher voocketed the cup. During the check, the rope voocketed the plate. After the visit, the artist voocketed the toy.",2,"[3273, 5156]","['Ġvo', 'ocket']",chef,animate, voocket,"Tomorrow, the chef will voocket",7,nonce|0051|voocket|T+,51,EleutherAI/pythia-1.4b,42,-11.909332275390625,11.909332275390625,11.909333229064941,164.24264526367188,0.07251060289455236
aligned,T+,"In the lab, the glass bufened the towel. During the check, the teacher bufened the vase. After the visit, the rope bufened the box. During the trial, the student will bufen",43,verb_final_subtoken,"[{'animacy': 'inanimate', 'object': 'towel', 'subject': 'glass'}, {'animacy': 'animate', 'object': 'vase', 'subject': 'teacher'}, {'animacy': 'inanimate', 'object': 'box', 'subject': 'rope'}]",bufen,3,"In the lab, the glass bufened the towel. During the check, the teacher bufened the vase. After the visit, the rope bufened the box.",2,"[15264, 257]","['Ġbuf', 'en']",student,animate, bufen,"During the trial, the student will bufen",9,nonce|0062|bufen|T+,62,EleutherAI/pythia-1.4b,42,-11.24435043334961,11.24435043334961,11.244351387023926,144.49671936035156,0.0778173472505097
aligned,T+,"In the lab, the worker draickened the toy. During the check, the glass draickened the rope. After the visit, the teacher draickened the lock. Tomorrow, the student will draicken",43,verb_final_subtoken,"[{'animacy': 'animate', 'object': 'toy', 'subject': 'worker'}, {'animacy': 'inanimate', 'object': 'rope', 'subject': 'glass'}, {'animacy': 'animate', 'object': 'lock', 'subject': 'teacher'}]",draicken,3,"In the lab, the worker draickened the toy. During the check, the glass draickened the rope. After the visit, the teacher draickened the lock.",2,"[6536, 20471]","['Ġdra', 'icken']",student,animate, draicken,"Tomorrow, the student will draicken",7,nonce|0063|draicken|T+,63,EleutherAI/pythia-1.4b,42,-9.88994026184082,9.88994026184082,9.889941215515137,158.56822204589844,0.062370259866144175
aligned,T-,"In the lab, the glass gleesheved. During the check, the teacher gleesheved. After the visit, the rope gleesheved. During the trial, the student will gleeshev",43,verb_final_subtoken,"[{'animacy': 'inanimate', 'object': '', 'subject': 'glass'}, {'animacy': 'animate', 'object': '', 'subject': 'teacher'}, {'animacy': 'inanimate', 'object': '', 'subject': 'rope'}]",gleeshev,3,"In the lab, the glass gleesheved. During the check, the teacher gleesheved. After the visit, the rope gleesheved.",3,"[20786, 265, 37552]","['Ġgle', 'es', 'hev']",student,animate, gleeshev,"During the trial, the student will gleeshev",10,nonce|0064|gleeshev|T-,64,EleutherAI/pythia-1.4b,42,-1.26035737991333,1.26035737991333,1.2603574991226196,102.95716094970703,0.012241572004285205
aligned,T+,"In the lab, the artist pleeshoped the plate. During the check, the door pleeshoped the toy. After the visit, the worker pleeshoped the rope. Tomorrow, the box will pleeshop",44,verb_final_subtoken,"[{'animacy': 'animate', 'object': 'plate', 'subject': 'artist'}, {'animacy': 'inanimate', 'object': 'toy', 'subject': 'door'}, {'animacy': 'animate', 'object': 'rope', 'subject': 'worker'}]",pleeshop,3,"In the lab, the artist pleeshoped the plate. During the check, the door pleeshoped the toy. After the visit, the worker pleeshoped the rope.",3,"[2318, 265, 12242]","['Ġple', 'es', 'hop']",box,inanimate, pleeshop,"Tomorrow, the box will pleeshop",8,nonce|0000|pleeshop|T+,0,EleutherAI/pythia-1.4b,43,-12.672266960144043,12.672266960144043,12.67226791381836,163.4022674560547,0.07755258302781161
aligned,T+,"In the lab, the artist fevived the toy. During the check, the door fevived the rope. After the visit, the worker fevived the lock. Later today, the shirt will feviv",44,verb_final_subtoken,"[{'animacy': 'animate', 'object': 'toy', 'subject': 'artist'}, {'animacy': 'inanimate', 'object': 'rope', 'subject': 'door'}, {'animacy': 'animate', 'object': 'lock', 'subject': 'worker'}]",feviv,3,"In the lab, the artist fevived the toy. During the check, the door fevived the rope. After the visit, the worker fevived the lock.",2,"[704, 40418]","['Ġfe', 'viv']",shirt,inanimate, feviv,"Later today, the shirt will feviv",8,nonce|0011|feviv|T+,11,EleutherAI/pythia-1.4b,43,-5.527048587799072,5.527048587799072,5.5270490646362305,113.6357192993164,0.04863830755607739
aligned,T+,"In the lab, the rope seziped the toy. During the check, the artist seziped the rope. After the visit, the door seziped the lock. Later today, the student will sezip",44,verb_final_subtoken,"[{'animacy': 'inanimate', 'object': 'toy', 'subject': 'rope'}, {'animacy': 'animate', 'object': 'rope', 'subject': 'artist'}, {'animacy': 'inanimate', 'object': 'lock', 'subject': 'door'}]",sezip,3,"In the lab, the rope seziped the toy. During the check, the artist seziped the rope. After the visit, the door seziped the lock.",2,"[396, 16368]","['Ġse', 'zip']",student,animate, sezip,"Later today, the student will sezip",8,nonce|0013|sezip|T+,13,EleutherAI/pythia-1.4b,43,-16.98699951171875,16.98699951171875,16.987001419067383,162.51356506347656,0.10452666774267359
aligned,T+,"In the lab, the artist veketed the lock. During the check, the door veketed the towel. After the visit, the worker veketed the vase. Tomorrow, the box will veket",44,verb_final_subtoken,"[{'animacy': 'animate', 'object': 'lock', 'subject': 'artist'}, {'animacy': 'inanimate', 'object': 'towel', 'subject': 'door'}, {'animacy': 'animate', 'object': 'vase', 'subject': 'worker'}]",veket,3,"In the lab, the artist veketed the lock. During the check, the door veketed the towel. After the visit, the worker veketed the vase.",2,"[1670, 7151]","['Ġve', 'ket']",box,inanimate, veket,"Tomorrow, the box will veket",7,nonce|0017|veket|T+,17,EleutherAI/pythia-1.4b,43,-8.99655818939209,8.99655818939209,8.99655818939209,141.84339904785156,0.0634259912677153
aligned,T+,"In the lab, the worker fifuped the toy. During the check, the glass fifuped the rope. After the visit, the teacher fifuped the lock. Later today, the shirt will fifup",44,verb_final_subtoken,"[{'animacy': 'animate', 'object': 'toy', 'subject': 'worker'}, {'animacy': 'inanimate', 'object': 'rope', 'subject': 'glass'}, {'animacy': 'animate', 'object': 'lock', 'subject': 'teacher'}]",fifup,3,"In the lab, the worker fifuped the toy. During the check, the glass fifuped the rope. After the visit, the teacher fifuped the lock.",2,"[5813, 484]","['Ġfif', 'up']",shirt,inanimate, fifup,"Later today, the shirt will fifup",8,nonce|0028|fifup|T+,28,EleutherAI/pythia-1.4b,43,-15.983179092407227,15.983179092407227,15.983180046081543,170.97569274902344,0.09348217743175563
aligned,T+,"In the lab, the teacher skaickled the toy. During the check, the rope skaickled the rope. After the visit, the artist skaickled the lock. Tomorrow, the box will skaickle",44,verb_final_subtoken,"[{'animacy': 'animate', 'object': 'toy', 'subject': 'teacher'}, {'animacy': 'inanimate', 'object': 'rope', 'subject': 'rope'}, {'animacy': 'animate', 'object': 'lock', 'subject': 'artist'}]",skaickle,3,"In the lab, the teacher skaickled the toy. During the check, the rope skaickled the rope. After the visit, the artist skaickled the lock.",3,"[42469, 781, 282]","['Ġska', 'ick', 'le']",box,inanimate, skaickle,"Tomorrow, the box will skaickle",8,nonce|0033|skaickle|T+,33,EleutherAI/pythia-1.4b,43,-11.910384178161621,11.910384178161621,11.910385131835938,157.06434631347656,0.07583124631012451
aligned,T+,"In the lab, the worker skaickoped the plate. During the check, the glass skaickoped the toy. After the visit, the teacher skaickoped the rope. Tomorrow, the student will skaickop",44,verb_final_subtoken,"[{'animacy': 'animate', 'object': 'plate', 'subject': 'worker'}, {'animacy': 'inanimate', 'object': 'toy', 'subject': 'glass'}, {'animacy': 'animate', 'object': 'rope', 'subject': 'teacher'}]",skaickop,3,"In the lab, the worker skaickoped the plate. During the check, the glass skaickoped the toy. After the visit, the teacher skaickoped the rope.",3,"[42469, 781, 412]","['Ġska', 'ick', 'op']",student,animate, skaickop,"Tomorrow, the student will skaickop",8,nonce|0034|skaickop|T+,34,EleutherAI/pythia-1.4b,43,-9.39502239227295,9.39502239227295,9.395023345947266,126.36467742919922,0.07434849308432095
aligned,T+,"In the lab, the artist draickled the rope. During the check, the door draickled the lock. After the visit, the worker draickled the towel. Tomorrow, the student will draickle",44,verb_final_subtoken,"[{'animacy': 'animate', 'object': 'rope', 'subject': 'artist'}, {'animacy': 'inanimate', 'object': 'lock', 'subject': 'door'}, {'animacy': 'animate', 'object': 'towel', 'subject': 'worker'}]",draickle,3,"In the lab, the artist draickled the rope. During the check, the door draickled the lock. After the visit, the worker draickled the towel.",3,"[6536, 781, 282]","['Ġdra', 'ick', 'le']",student,animate, draickle,"Tomorrow, the student will draickle",8,nonce|0037|draickle|T+,37,EleutherAI/pythia-1.4b,43,-15.331361770629883,15.331361770629883,15.3313627243042,174.32623291015625,0.0879463891828927
aligned,T+,"In the lab, the rope zebled the towel. During the check, the artist zebled the vase. After the visit, the door zebled the box. Tomorrow, the driver will zeble",44,verb_final_subtoken,"[{'animacy': 'inanimate', 'object': 'towel', 'subject': 'rope'}, {'animacy': 'animate', 'object': 'vase', 'subject': 'artist'}, {'animacy': 'inanimate', 'object': 'box', 'subject': 'door'}]",zeble,3,"In the lab, the rope zebled the towel. During the check, the artist zebled the vase. After the visit, the door zebled the box.",2,"[14756, 934]","['Ġze', 'ble']",driver,animate, zeble,"Tomorrow, the driver will zeble",7,nonce|0048|zeble|T+,48,EleutherAI/pythia-1.4b,43,-13.306381225585938,13.306381225585938,13.306382179260254,166.06480407714844,0.08012764807814744
aligned,T+,"In the lab, the glass vefeted the cup. During the check, the teacher vefeted the plate. After the visit, the rope vefeted the toy. Later today, the driver will vefet",44,verb_final_subtoken,"[{'animacy': 'inanimate', 'object': 'cup', 'subject': 'glass'}, {'animacy': 'animate', 'object': 'plate', 'subject': 'teacher'}, {'animacy': 'inanimate', 'object': 'toy', 'subject': 'rope'}]",vefet,3,"In the lab, the glass vefeted the cup. During the check, the teacher vefeted the plate. After the visit, the rope vefeted the toy.",2,"[1670, 39792]","['Ġve', 'fet']",driver,animate, vefet,"Later today, the driver will vefet",8,nonce|0058|vefet|T+,58,EleutherAI/pythia-1.4b,43,-10.421725273132324,10.421725273132324,10.42172622680664,135.81393432617188,0.07673532379805548
aligned,T+,"In the lab, the door droockled the rope. During the check, the worker droockled the lock. After the visit, the glass droockled the towel. Tomorrow, the paper will droockle",44,verb_final_subtoken,"[{'animacy': 'inanimate', 'object': 'rope', 'subject': 'door'}, {'animacy': 'animate', 'object': 'lock', 'subject': 'worker'}, {'animacy': 'inanimate', 'object': 'towel', 'subject': 'glass'}]",droockle,3,"In the lab, the door droockled the rope. During the check, the worker droockled the lock. After the visit, the glass droockled the towel.",3,"[3926, 825, 282]","['Ġdro', 'ock', 'le']",paper,inanimate, droockle,"Tomorrow, the paper will droockle",8,nonce|0059|droockle|T+,59,EleutherAI/pythia-1.4b,43,-14.25798225402832,14.25798225402832,14.257983207702637,153.0474853515625,0.0931605192659709
aligned,T+,"In the lab, the teacher texeved the plate. During the check, the rope texeved the toy. After the visit, the artist texeved the rope. Later today, the student will texev",44,verb_final_subtoken,"[{'animacy': 'animate', 'object': 'plate', 'subject': 'teacher'}, {'animacy': 'inanimate', 'object': 'toy', 'subject': 'rope'}, {'animacy': 'animate', 'object': 'rope', 'subject': 'artist'}]",texev,3,"In the lab, the teacher texeved the plate. During the check, the rope texeved the toy. After the visit, the artist texeved the rope.",2,"[30557, 1173]","['Ġtex', 'ev']",student,animate, texev,"Later today, the student will texev",8,nonce|0060|texev|T+,60,EleutherAI/pythia-1.4b,43,-6.518836975097656,6.518836975097656,6.5188374519348145,132.17816162109375,0.04931856648620918
aligned,T+,"In the lab, the worker feleved the toy. During the check, the glass feleved the rope. After the visit, the teacher feleved the lock. Later today, the paper will felev",44,verb_final_subtoken,"[{'animacy': 'animate', 'object': 'toy', 'subject': 'worker'}, {'animacy': 'inanimate', 'object': 'rope', 'subject': 'glass'}, {'animacy': 'animate', 'object': 'lock', 'subject': 'teacher'}]",felev,3,"In the lab, the worker feleved the toy. During the check, the glass feleved the rope. After the visit, the teacher feleved the lock.",2,"[704, 20852]","['Ġfe', 'lev']",paper,inanimate, felev,"Later today, the paper will felev",8,nonce|0066|felev|T+,66,EleutherAI/pythia-1.4b,43,-7.554563045501709,7.554563045501709,7.554563999176025,111.2989501953125,0.06787632754773455
aligned,T+,"In the lab, the worker zuvened the box. During the check, the glass zuvened the cup. After the visit, the teacher zuvened the plate. Later today, the shirt will zuven",44,verb_final_subtoken,"[{'animacy': 'animate', 'object': 'box', 'subject': 'worker'}, {'animacy': 'inanimate', 'object': 'cup', 'subject': 'glass'}, {'animacy': 'animate', 'object': 'plate', 'subject': 'teacher'}]",zuven,3,"In the lab, the worker zuvened the box. During the check, the glass zuvened the cup. After the visit, the teacher zuvened the plate.",2,"[10736, 1261]","['Ġzu', 'ven']",shirt,inanimate, zuven,"Later today, the shirt will zuven",8,nonce|0070|zuven|T+,70,EleutherAI/pythia-1.4b,43,-9.66808032989502,9.66808032989502,9.668081283569336,149.68426513671875,0.06458983029872041
aligned,T+,"In the lab, the teacher vezeved the lock. During the check, the rope vezeved the towel. After the visit, the artist vezeved the vase. Tomorrow, the student will vezev",44,verb_final_subtoken,"[{'animacy': 'animate', 'object': 'lock', 'subject': 'teacher'}, {'animacy': 'inanimate', 'object': 'towel', 'subject': 'rope'}, {'animacy': 'animate', 'object': 'vase', 'subject': 'artist'}]",vezev,3,"In the lab, the teacher vezeved the lock. During the check, the rope vezeved the towel. After the visit, the artist vezeved the vase.",2,"[24005, 1173]","['Ġvez', 'ev']",student,animate, vezev,"Tomorrow, the student will vezev",7,nonce|0075|vezev|T+,75,EleutherAI/pythia-1.4b,43,-5.193453311920166,5.193453311920166,5.193453788757324,117.01795196533203,0.044381684190609894
aligned,T+,"In the lab, the glass difeved the box. During the check, the teacher difeved the cup. After the visit, the rope difeved the plate. During the trial, the box will difev",45,verb_final_subtoken,"[{'animacy': 'inanimate', 'object': 'box', 'subject': 'glass'}, {'animacy': 'animate', 'object': 'cup', 'subject': 'teacher'}, {'animacy': 'inanimate', 'object': 'plate', 'subject': 'rope'}]",difev,3,"In the lab, the glass difeved the box. During the check, the teacher difeved the cup. After the visit, the rope difeved the plate.",2,"[722, 1173]","['Ġdif', 'ev']",box,inanimate, difev,"During the trial, the box will difev",9,nonce|0003|difev|T+,3,EleutherAI/pythia-1.4b,44,-6.009804725646973,6.009804725646973,6.009805202484131,134.62217712402344,0.044642014643304084
aligned,T+,"In the lab, the worker kekomed the box. During the check, the glass kekomed the cup. After the visit, the teacher kekomed the plate. During the trial, the driver will kekom",45,verb_final_subtoken,"[{'animacy': 'animate', 'object': 'box', 'subject': 'worker'}, {'animacy': 'inanimate', 'object': 'cup', 'subject': 'glass'}, {'animacy': 'animate', 'object': 'plate', 'subject': 'teacher'}]",kekom,3,"In the lab, the worker kekomed the box. During the check, the glass kekomed the cup. After the visit, the teacher kekomed the plate.",2,"[1058, 21971]","['Ġke', 'kom']",driver,animate, kekom,"During the trial, the driver will kekom",9,nonce|0010|kekom|T+,10,EleutherAI/pythia-1.4b,44,-4.077467918395996,4.077467918395996,4.077468395233154,110.4124984741211,0.036929409727910895
aligned,T+,"In the lab, the door gufened the rope. During the check, the worker gufened the lock. After the visit, the glass gufened the towel. During the trial, the shirt will gufen",45,verb_final_subtoken,"[{'animacy': 'inanimate', 'object': 'rope', 'subject': 'door'}, {'animacy': 'animate', 'object': 'lock', 'subject': 'worker'}, {'animacy': 'inanimate', 'object': 'towel', 'subject': 'glass'}]",gufen,3,"In the lab, the door gufened the rope. During the check, the worker gufened the lock. After the visit, the glass gufened the towel.",2,"[1149, 25947]","['Ġgu', 'fen']",shirt,inanimate, gufen,"During the trial, the shirt will gufen",9,nonce|0015|gufen|T+,15,EleutherAI/pythia-1.4b,44,-10.170419692993164,10.170419692993164,10.17042064666748,143.43115234375,0.07090803134797972
aligned,T+,"In the lab, the rope zezeted the vase. During the check, the artist zezeted the box. After the visit, the door zezeted the cup. Later today, the box will zezet",45,verb_final_subtoken,"[{'animacy': 'inanimate', 'object': 'vase', 'subject': 'rope'}, {'animacy': 'animate', 'object': 'box', 'subject': 'artist'}, {'animacy': 'inanimate', 'object': 'cup', 'subject': 'door'}]",zezet,3,"In the lab, the rope zezeted the vase. During the check, the artist zezeted the box. After the visit, the door zezeted the cup.",2,"[14756, 39753]","['Ġze', 'zet']",box,inanimate, zezet,"Later today, the box will zezet",8,nonce|0022|zezet|T+,22,EleutherAI/pythia-1.4b,44,-8.674184799194336,8.674184799194336,8.674185752868652,130.37457275390625,0.06653280290507228
aligned,T+,"In the lab, the door pefeted the cup. During the check, the worker pefeted the plate. After the visit, the glass pefeted the toy. During the trial, the shirt will pefet",45,verb_final_subtoken,"[{'animacy': 'inanimate', 'object': 'cup', 'subject': 'door'}, {'animacy': 'animate', 'object': 'plate', 'subject': 'worker'}, {'animacy': 'inanimate', 'object': 'toy', 'subject': 'glass'}]",pefet,3,"In the lab, the door pefeted the cup. During the check, the worker pefeted the plate. After the visit, the glass pefeted the toy.",2,"[759, 39792]","['Ġpe', 'fet']",shirt,inanimate, pefet,"During the trial, the shirt will pefet",9,nonce|0024|pefet|T+,24,EleutherAI/pythia-1.4b,44,-7.510067939758301,7.510067939758301,7.510068416595459,117.9958724975586,0.06364687389171894
aligned,T+,"In the lab, the worker nexeved the box. During the check, the glass nexeved the cup. After the visit, the teacher nexeved the plate. During the trial, the student will nexev",45,verb_final_subtoken,"[{'animacy': 'animate', 'object': 'box', 'subject': 'worker'}, {'animacy': 'inanimate', 'object': 'cup', 'subject': 'glass'}, {'animacy': 'animate', 'object': 'plate', 'subject': 'teacher'}]",nexev,3,"In the lab, the worker nexeved the box. During the check, the glass nexeved the cup. After the visit, the teacher nexeved the plate.",2,"[47103, 1173]","['Ġnex', 'ev']",student,animate, nexev,"During the trial, the student will nexev",9,nonce|0032|nexev|T+,32,EleutherAI/pythia-1.4b,44,-8.159318923950195,8.159318923950195,8.159319877624512,128.48471069335938,0.06350420866104046
aligned,T+,"In the lab, the rope veduped the cup. During the check, the artist veduped the plate. After the visit, the door veduped the toy. During the trial, the student will vedup",45,verb_final_subtoken,"[{'animacy': 'inanimate', 'object': 'cup', 'subject': 'rope'}, {'animacy': 'animate', 'object': 'plate', 'subject': 'artist'}, {'animacy': 'inanimate', 'object': 'toy', 'subject': 'door'}]",vedup,3,"In the lab, the rope veduped the cup. During the check, the artist veduped the plate. After the visit, the door veduped the toy.",2,"[27685, 484]","['Ġved', 'up']",student,animate, vedup,"During the trial, the student will vedup",9,nonce|0035|vedup|T+,35,EleutherAI/pythia-1.4b,44,-10.410720825195312,10.410720825195312,10.410720825195312,152.58547973632812,0.06822877801469263
