alignment_status,frame,full_context,full_context_token_count,intervention_anchor,lead_subjects,lemma,n_leads,priming_text,probe_form_token_count,probe_form_token_ids,probe_form_token_pieces,probe_subject,probe_subject_animacy,probe_surface,probe_text,probe_token_count,row_id,stem_index,tokenizer_model,verb_final_tok_idx,coord_0_raw,coord_0_calibrated,projection_norm,residual_norm,projection_norm_frac
aligned,T-,"In the lab, the door gleeshived. During the check, the worker gleeshived. After the visit, the glass gleeshived. During the trial, the paper will gleeshiv",40,verb_final_subtoken,"[{'animacy': 'inanimate', 'object': '', 'subject': 'door'}, {'animacy': 'animate', 'object': '', 'subject': 'worker'}, {'animacy': 'inanimate', 'object': '', 'subject': 'glass'}]",gleeshiv,3,"In the lab, the door gleeshived. During the check, the worker gleeshived. After the visit, the glass gleeshived.",3,"[20786, 15897, 400]","['Ġgle', 'esh', 'iv']",paper,inanimate, gleeshiv,"During the trial, the paper will gleeshiv",10,nonce|0005|gleeshiv|T-,5,EleutherAI/pythia-1.4b,39,-1.305715560913086,1.305715560913086,1.3057156801223755,123.28923034667969,0.01059067102982803
aligned,T+,"In the lab, the glass bipumed the rope. During the check, the teacher bipumed the lock. After the visit, the rope bipumed the towel. Tomorrow, the paper will bipum",40,verb_final_subtoken,"[{'animacy': 'inanimate', 'object': 'rope', 'subject': 'glass'}, {'animacy': 'animate', 'object': 'lock', 'subject': 'teacher'}, {'animacy': 'inanimate', 'object': 'towel', 'subject': 'rope'}]",bipum,3,"In the lab, the glass bipumed the rope. During the check, the teacher bipumed the lock. After the visit, the rope bipumed the towel.",2,"[15086, 360]","['Ġbip', 'um']",paper,inanimate, bipum,"Tomorrow, the paper will bipum",7,nonce|0008|bipum|T+,8,EleutherAI/pythia-1.4b,39,-7.568526744842529,7.568526744842529,7.5685272216796875,113.0793228149414,0.06693113323702751
aligned,T+,"In the lab, the teacher vidived the rope. During the check, the rope vidived the lock. After the visit, the artist vidived the towel. Tomorrow, the shirt will vidiv",40,verb_final_subtoken,"[{'animacy': 'animate', 'object': 'rope', 'subject': 'teacher'}, {'animacy': 'inanimate', 'object': 'lock', 'subject': 'rope'}, {'animacy': 'animate', 'object': 'towel', 'subject': 'artist'}]",vidiv,3,"In the lab, the teacher vidived the rope. During the check, the rope vidived the lock. After the visit, the artist vidived the towel.",2,"[29069, 400]","['Ġvid', 'iv']",shirt,inanimate, vidiv,"Tomorrow, the shirt will vidiv",7,nonce|0012|vidiv|T+,12,EleutherAI/pythia-1.4b,39,-5.519999980926514,5.519999980926514,5.519999980926514,119.08625793457031,0.04635295521637243
aligned,T+,"In the lab, the rope texomed the cup. During the check, the artist texomed the plate. After the visit, the door texomed the toy. Tomorrow, the paper will texom",40,verb_final_subtoken,"[{'animacy': 'inanimate', 'object': 'cup', 'subject': 'rope'}, {'animacy': 'animate', 'object': 'plate', 'subject': 'artist'}, {'animacy': 'inanimate', 'object': 'toy', 'subject': 'door'}]",texom,3,"In the lab, the rope texomed the cup. During the check, the artist texomed the plate. After the visit, the door texomed the toy.",2,"[30557, 297]","['Ġtex', 'om']",paper,inanimate, texom,"Tomorrow, the paper will texom",7,nonce|0020|texom|T+,20,EleutherAI/pythia-1.4b,39,-1.807252287864685,1.807252287864685,1.8072524070739746,100.60879516601562,0.017963165189403257
aligned,T+,"In the lab, the glass vezoped the box. During the check, the teacher vezoped the cup. After the visit, the rope vezoped the plate. Tomorrow, the chef will vezop",40,verb_final_subtoken,"[{'animacy': 'inanimate', 'object': 'box', 'subject': 'glass'}, {'animacy': 'animate', 'object': 'cup', 'subject': 'teacher'}, {'animacy': 'inanimate', 'object': 'plate', 'subject': 'rope'}]",vezop,3,"In the lab, the glass vezoped the box. During the check, the teacher vezoped the cup. After the visit, the rope vezoped the plate.",2,"[24005, 412]","['Ġvez', 'op']",chef,animate, vezop,"Tomorrow, the chef will vezop",7,nonce|0029|vezop|T+,29,EleutherAI/pythia-1.4b,39,-13.520264625549316,13.520264625549316,13.520265579223633,161.0363311767578,0.08395785895285596
aligned,T+,"In the lab, the rope sugoped the box. During the check, the artist sugoped the cup. After the visit, the door sugoped the plate. Tomorrow, the driver will sugop",40,verb_final_subtoken,"[{'animacy': 'inanimate', 'object': 'box', 'subject': 'rope'}, {'animacy': 'animate', 'object': 'cup', 'subject': 'artist'}, {'animacy': 'inanimate', 'object': 'plate', 'subject': 'door'}]",sugop,3,"In the lab, the rope sugoped the box. During the check, the artist sugoped the cup. After the visit, the door sugoped the plate.",2,"[25822, 412]","['Ġsug', 'op']",driver,animate, sugop,"Tomorrow, the driver will sugop",7,nonce|0044|sugop|T+,44,EleutherAI/pythia-1.4b,39,-9.928362846374512,9.928362846374512,9.928363800048828,131.14845275878906,0.0757032476647611
aligned,T-,"In the lab, the teacher draickoped. During the check, the rope draickoped. After the visit, the artist draickoped. During the trial, the chef will draickop",40,verb_final_subtoken,"[{'animacy': 'animate', 'object': '', 'subject': 'teacher'}, {'animacy': 'inanimate', 'object': '', 'subject': 'rope'}, {'animacy': 'animate', 'object': '', 'subject': 'artist'}]",draickop,3,"In the lab, the teacher draickoped. During the check, the rope draickoped. After the visit, the artist draickoped.",3,"[6536, 781, 412]","['Ġdra', 'ick', 'op']",chef,animate, draickop,"During the trial, the chef will draickop",10,nonce|0046|draickop|T-,46,EleutherAI/pythia-1.4b,39,-2.9154422283172607,2.9154422283172607,2.91544246673584,118.5057144165039,0.024601703648561065
aligned,T+,"In the lab, the door vigeted the toy. During the check, the worker vigeted the rope. After the visit, the glass vigeted the lock. Tomorrow, the shirt will viget",40,verb_final_subtoken,"[{'animacy': 'inanimate', 'object': 'toy', 'subject': 'door'}, {'animacy': 'animate', 'object': 'rope', 'subject': 'worker'}, {'animacy': 'inanimate', 'object': 'lock', 'subject': 'glass'}]",viget,3,"In the lab, the door vigeted the toy. During the check, the worker vigeted the rope. After the visit, the glass vigeted the lock.",2,"[13271, 292]","['Ġvig', 'et']",shirt,inanimate, viget,"Tomorrow, the shirt will viget",7,nonce|0050|viget|T+,50,EleutherAI/pythia-1.4b,39,-11.543498992919922,11.543498992919922,11.543499946594238,170.762939453125,0.06759956219752804
aligned,T-,"In the lab, the rope skaickumed. During the check, the artist skaickumed. After the visit, the door skaickumed. During the trial, the shirt will skaickum",40,verb_final_subtoken,"[{'animacy': 'inanimate', 'object': '', 'subject': 'rope'}, {'animacy': 'animate', 'object': '', 'subject': 'artist'}, {'animacy': 'inanimate', 'object': '', 'subject': 'door'}]",skaickum,3,"In the lab, the rope skaickumed. During the check, the artist skaickumed. After the visit, the door skaickumed.",3,"[42469, 781, 360]","['Ġska', 'ick', 'um']",shirt,inanimate, skaickum,"During the trial, the shirt will skaickum",10,nonce|0055|skaickum|T-,55,EleutherAI/pythia-1.4b,39,0.7843034267425537,-0.7843034267425537,0.7843034863471985,129.5357208251953,0.006054727463211428
aligned,T+,"In the lab, the door bifumed the box. During the check, the worker bifumed the cup. After the visit, the glass bifumed the plate. Tomorrow, the shirt will bifum",40,verb_final_subtoken,"[{'animacy': 'inanimate', 'object': 'box', 'subject': 'door'}, {'animacy': 'animate', 'object': 'cup', 'subject': 'worker'}, {'animacy': 'inanimate', 'object': 'plate', 'subject': 'glass'}]",bifum,3,"In the lab, the door bifumed the box. During the check, the worker bifumed the cup. After the visit, the glass bifumed the plate.",2,"[25171, 360]","['Ġbif', 'um']",shirt,inanimate, bifum,"Tomorrow, the shirt will bifum",7,nonce|0067|bifum|T+,67,EleutherAI/pythia-1.4b,39,-10.208176612854004,10.208176612854004,10.20817756652832,124.59044647216797,0.08193387097949525
aligned,T-,"In the lab, the worker droockened. During the check, the glass droockened. After the visit, the teacher droockened. During the trial, the box will droocken",40,verb_final_subtoken,"[{'animacy': 'animate', 'object': '', 'subject': 'worker'}, {'animacy': 'inanimate', 'object': '', 'subject': 'glass'}, {'animacy': 'animate', 'object': '', 'subject': 'teacher'}]",droocken,3,"In the lab, the worker droockened. During the check, the glass droockened. After the visit, the teacher droockened.",3,"[3926, 825, 257]","['Ġdro', 'ock', 'en']",box,inanimate, droocken,"During the trial, the box will droocken",10,nonce|0069|droocken|T-,69,EleutherAI/pythia-1.4b,39,-3.649487257003784,3.649487257003784,3.6494874954223633,147.73617553710938,0.024702734331346354
aligned,T+,"In the lab, the teacher tobived the towel. During the check, the rope tobived the vase. After the visit, the artist tobived the box. Tomorrow, the paper will tobiv",41,verb_final_subtoken,"[{'animacy': 'animate', 'object': 'towel', 'subject': 'teacher'}, {'animacy': 'inanimate', 'object': 'vase', 'subject': 'rope'}, {'animacy': 'animate', 'object': 'box', 'subject': 'artist'}]",tobiv,3,"In the lab, the teacher tobived the towel. During the check, the rope tobived the vase. After the visit, the artist tobived the box.",2,"[15485, 400]","['Ġtob', 'iv']",paper,inanimate, tobiv,"Tomorrow, the paper will tobiv",7,nonce|0009|tobiv|T+,9,EleutherAI/pythia-1.4b,40,-1.9758384227752686,1.9758384227752686,1.975838541984558,104.01235961914062,0.018996189964533398
aligned,T+,"In the lab, the door dizoped the plate. During the check, the worker dizoped the toy. After the visit, the glass dizoped the rope. Later today, the student will dizop",41,verb_final_subtoken,"[{'animacy': 'inanimate', 'object': 'plate', 'subject': 'door'}, {'animacy': 'animate', 'object': 'toy', 'subject': 'worker'}, {'animacy': 'inanimate', 'object': 'rope', 'subject': 'glass'}]",dizop,3,"In the lab, the door dizoped the plate. During the check, the worker dizoped the toy. After the visit, the glass dizoped the rope.",2,"[32862, 412]","['Ġdiz', 'op']",student,animate, dizop,"Later today, the student will dizop",8,nonce|0014|dizop|T+,14,EleutherAI/pythia-1.4b,40,-12.674415588378906,12.674415588378906,12.674416542053223,142.12376403808594,0.08917872832763399
aligned,T-,"In the lab, the door droockiped. During the check, the worker droockiped. After the visit, the glass droockiped. Tomorrow, the shirt will droockip",41,verb_final_subtoken,"[{'animacy': 'inanimate', 'object': '', 'subject': 'door'}, {'animacy': 'animate', 'object': '', 'subject': 'worker'}, {'animacy': 'inanimate', 'object': '', 'subject': 'glass'}]",droockip,3,"In the lab, the door droockiped. During the check, the worker droockiped. After the visit, the glass droockiped.",3,"[3926, 825, 532]","['Ġdro', 'ock', 'ip']",shirt,inanimate, droockip,"Tomorrow, the shirt will droockip",8,nonce|0016|droockip|T-,16,EleutherAI/pythia-1.4b,40,1.1799335479736328,-1.1799335479736328,1.1799336671829224,152.3502655029297,0.0077448743741128055
aligned,T+,"In the lab, the artist bufumed the box. During the check, the door bufumed the cup. After the visit, the worker bufumed the plate. Later today, the student will bufum",41,verb_final_subtoken,"[{'animacy': 'animate', 'object': 'box', 'subject': 'artist'}, {'animacy': 'inanimate', 'object': 'cup', 'subject': 'door'}, {'animacy': 'animate', 'object': 'plate', 'subject': 'worker'}]",bufum,3,"In the lab, the artist bufumed the box. During the check, the door bufumed the cup. After the visit, the worker bufumed the plate.",2,"[15264, 360]","['Ġbuf', 'um']",student,animate, bufum,"Later today, the student will bufum",8,nonce|0031|bufum|T+,31,EleutherAI/pythia-1.4b,40,-8.856599807739258,8.856599807739258,8.856600761413574,132.92286682128906,0.06662962493369194
aligned,T+,"In the lab, the artist fifumed the vase. During the check, the door fifumed the box. After the visit, the worker fifumed the cup. Tomorrow, the driver will fifum",41,verb_final_subtoken,"[{'animacy': 'animate', 'object': 'vase', 'subject': 'artist'}, {'animacy': 'inanimate', 'object': 'box', 'subject': 'door'}, {'animacy': 'animate', 'object': 'cup', 'subject': 'worker'}]",fifum,3,"In the lab, the artist fifumed the vase. During the check, the door fifumed the box. After the visit, the worker fifumed the cup.",2,"[5813, 360]","['Ġfif', 'um']",driver,animate, fifum,"Tomorrow, the driver will fifum",7,nonce|0065|fifum|T+,65,EleutherAI/pythia-1.4b,40,-8.956853866577148,8.956853866577148,8.956853866577148,123.0997543334961,0.07276094022341961
aligned,T+,"In the lab, the door novived the toy. During the check, the worker novived the rope. After the visit, the glass novived the lock. During the trial, the paper will noviv",42,verb_final_subtoken,"[{'animacy': 'inanimate', 'object': 'toy', 'subject': 'door'}, {'animacy': 'animate', 'object': 'rope', 'subject': 'worker'}, {'animacy': 'inanimate', 'object': 'lock', 'subject': 'glass'}]",noviv,3,"In the lab, the door novived the toy. During the check, the worker novived the rope. After the visit, the glass novived the lock.",2,"[22458, 400]","['Ġnov', 'iv']",paper,inanimate, noviv,"During the trial, the paper will noviv",9,nonce|0004|noviv|T+,4,EleutherAI/pythia-1.4b,41,-3.038039207458496,3.038039207458496,3.038039207458496,112.24637603759766,0.02706581107296404
aligned,T+,"In the lab, the glass givomed the box. During the check, the teacher givomed the cup. After the visit, the rope givomed the plate. During the trial, the box will givom",42,verb_final_subtoken,"[{'animacy': 'inanimate', 'object': 'box', 'subject': 'glass'}, {'animacy': 'animate', 'object': 'cup', 'subject': 'teacher'}, {'animacy': 'inanimate', 'object': 'plate', 'subject': 'rope'}]",givom,3,"In the lab, the glass givomed the box. During the check, the teacher givomed the cup. After the visit, the rope givomed the plate.",2,"[1259, 297]","['Ġgiv', 'om']",box,inanimate, givom,"During the trial, the box will givom",9,nonce|0021|givom|T+,21,EleutherAI/pythia-1.4b,41,-8.535481452941895,8.535481452941895,8.535482406616211,120.60388946533203,0.07077286184099198
aligned,T+,"In the lab, the teacher vomomed the cup. During the check, the rope vomomed the plate. After the visit, the artist vomomed the toy. During the trial, the student will vomom",42,verb_final_subtoken,"[{'animacy': 'animate', 'object': 'cup', 'subject': 'teacher'}, {'animacy': 'inanimate', 'object': 'plate', 'subject': 'rope'}, {'animacy': 'animate', 'object': 'toy', 'subject': 'artist'}]",vomom,3,"In the lab, the teacher vomomed the cup. During the check, the rope vomomed the plate. After the visit, the artist vomomed the toy.",2,"[20648, 297]","['Ġvom', 'om']",student,animate, vomom,"During the trial, the student will vomom",9,nonce|0038|vomom|T+,38,EleutherAI/pythia-1.4b,41,-8.968749046325684,8.968749046325684,8.96875,117.82903289794922,0.07611663933258081
aligned,T+,"In the lab, the glass vonoped the towel. During the check, the teacher vonoped the vase. After the visit, the rope vonoped the box. Later today, the shirt will vonop",42,verb_final_subtoken,"[{'animacy': 'inanimate', 'object': 'towel', 'subject': 'glass'}, {'animacy': 'animate', 'object': 'vase', 'subject': 'teacher'}, {'animacy': 'inanimate', 'object': 'box', 'subject': 'rope'}]",vonop,3,"In the lab, the glass vonoped the towel. During the check, the teacher vonoped the vase. After the visit, the rope vonoped the box.",2,"[8449, 412]","['Ġvon', 'op']",shirt,inanimate, vonop,"Later today, the shirt will vonop",8,nonce|0043|vonop|T+,43,EleutherAI/pythia-1.4b,41,-11.135370254516602,11.135370254516602,11.135371208190918,127.99423217773438,0.0869990078359797
aligned,T+,"In the lab, the door vizoped the vase. During the check, the worker vizoped the box. After the visit, the glass vizoped the cup. Later today, the box will vizop",42,verb_final_subtoken,"[{'animacy': 'inanimate', 'object': 'vase', 'subject': 'door'}, {'animacy': 'animate', 'object': 'box', 'subject': 'worker'}, {'animacy': 'inanimate', 'object': 'cup', 'subject': 'glass'}]",vizop,3,"In the lab, the door vizoped the vase. During the check, the worker vizoped the box. After the visit, the glass vizoped the cup.",2,"[40027, 412]","['Ġviz', 'op']",box,inanimate, vizop,"Later today, the box will vizop",8,nonce|0045|vizop|T+,45,EleutherAI/pythia-1.4b,41,-6.17399787902832,6.17399787902832,6.1739983558654785,104.93223571777344,0.05883795683598234
aligned,T+,"In the lab, the rope mulomed the cup. During the check, the artist mulomed the plate. After the visit, the door mulomed the toy. During the trial, the chef will mulom",42,verb_final_subtoken,"[{'animacy': 'inanimate', 'object': 'cup', 'subject': 'rope'}, {'animacy': 'animate', 'object': 'plate', 'subject': 'artist'}, {'animacy': 'inanimate', 'object': 'toy', 'subject': 'door'}]",mulom,3,"In the lab, the rope mulomed the cup. During the check, the artist mulomed the plate. After the visit, the door mulomed the toy.",2,"[22871, 297]","['Ġmul', 'om']",chef,animate, mulom,"During the trial, the chef will mulom",9,nonce|0053|mulom|T+,53,EleutherAI/pythia-1.4b,41,-8.212697982788086,8.212697982788086,8.212698936462402,111.11725616455078,0.07391020278884876
aligned,T+,"In the lab, the worker vilomed the vase. During the check, the glass vilomed the box. After the visit, the teacher vilomed the cup. Later today, the student will vilom",42,verb_final_subtoken,"[{'animacy': 'animate', 'object': 'vase', 'subject': 'worker'}, {'animacy': 'inanimate', 'object': 'box', 'subject': 'glass'}, {'animacy': 'animate', 'object': 'cup', 'subject': 'teacher'}]",vilom,3,"In the lab, the worker vilomed the vase. During the check, the glass vilomed the box. After the visit, the teacher vilomed the cup.",2,"[20442, 297]","['Ġvil', 'om']",student,animate, vilom,"Later today, the student will vilom",8,nonce|0054|vilom|T+,54,EleutherAI/pythia-1.4b,41,-7.7594780921936035,7.7594780921936035,7.759478569030762,104.70499420166016,0.07410800820146295
aligned,T+,"In the lab, the teacher vonened the towel. During the check, the rope vonened the vase. After the visit, the artist vonened the box. Later today, the student will vonen",42,verb_final_subtoken,"[{'animacy': 'animate', 'object': 'towel', 'subject': 'teacher'}, {'animacy': 'inanimate', 'object': 'vase', 'subject': 'rope'}, {'animacy': 'animate', 'object': 'box', 'subject': 'artist'}]",vonen,3,"In the lab, the teacher vonened the towel. During the check, the rope vonened the vase. After the visit, the artist vonened the box.",2,"[8449, 257]","['Ġvon', 'en']",student,animate, vonen,"Later today, the student will vonen",8,nonce|0056|vonen|T+,56,EleutherAI/pythia-1.4b,41,-10.332646369934082,10.332646369934082,10.332647323608398,158.1353759765625,0.06534051764065629
aligned,T+,"In the lab, the glass zumumed the box. During the check, the teacher zumumed the cup. After the visit, the rope zumumed the plate. During the trial, the student will zumum",42,verb_final_subtoken,"[{'animacy': 'inanimate', 'object': 'box', 'subject': 'glass'}, {'animacy': 'animate', 'object': 'cup', 'subject': 'teacher'}, {'animacy': 'inanimate', 'object': 'plate', 'subject': 'rope'}]",zumum,3,"In the lab, the glass zumumed the box. During the check, the teacher zumumed the cup. After the visit, the rope zumumed the plate.",2,"[30070, 360]","['Ġzum', 'um']",student,animate, zumum,"During the trial, the student will zumum",9,nonce|0061|zumum|T+,61,EleutherAI/pythia-1.4b,41,-4.4916181564331055,4.4916181564331055,4.491618633270264,127.26219940185547,0.0352942087625493
aligned,T-,"In the lab, the rope kloozened. During the check, the artist kloozened. After the visit, the door kloozened. Later today, the box will kloozen",42,verb_final_subtoken,"[{'animacy': 'inanimate', 'object': '', 'subject': 'rope'}, {'animacy': 'animate', 'object': '', 'subject': 'artist'}, {'animacy': 'inanimate', 'object': '', 'subject': 'door'}]",kloozen,3,"In the lab, the rope kloozened. During the check, the artist kloozened. After the visit, the door kloozened.",3,"[27451, 3288, 5282]","['Ġkl', 'oo', 'zen']",box,inanimate, kloozen,"Later today, the box will kloozen",9,nonce|0073|kloozen|T-,73,EleutherAI/pythia-1.4b,41,-2.1550323963165283,2.1550323963165283,2.1550323963165283,152.2058868408203,0.01415866653416829
aligned,T-,"In the lab, the door gleesheted. During the check, the worker gleesheted. After the visit, the glass gleesheted. Later today, the paper will gleeshet",42,verb_final_subtoken,"[{'animacy': 'inanimate', 'object': '', 'subject': 'door'}, {'animacy': 'animate', 'object': '', 'subject': 'worker'}, {'animacy': 'inanimate', 'object': '', 'subject': 'glass'}]",gleeshet,3,"In the lab, the door gleesheted. During the check, the worker gleesheted. After the visit, the glass gleesheted.",3,"[20786, 265, 6168]","['Ġgle', 'es', 'het']",paper,inanimate, gleeshet,"Later today, the paper will gleeshet",9,nonce|0076|gleeshet|T-,76,EleutherAI/pythia-1.4b,41,5.087724685668945,-5.087724685668945,5.0877251625061035,136.98785400390625,0.03713997273335653
aligned,T+,"In the lab, the rope gefled the plate. During the check, the artist gefled the toy. After the visit, the door gefled the rope. During the trial, the paper will gefle",42,verb_final_subtoken,"[{'animacy': 'inanimate', 'object': 'plate', 'subject': 'rope'}, {'animacy': 'animate', 'object': 'toy', 'subject': 'artist'}, {'animacy': 'inanimate', 'object': 'rope', 'subject': 'door'}]",gefle,3,"In the lab, the rope gefled the plate. During the check, the artist gefled the toy. After the visit, the door gefled the rope.",2,"[41817, 282]","['Ġgef', 'le']",paper,inanimate, gefle,"During the trial, the paper will gefle",9,nonce|0078|gefle|T+,78,EleutherAI/pythia-1.4b,41,-7.862839698791504,7.862839698791504,7.862840175628662,123.16272735595703,0.06384106900218266
aligned,T+,"In the lab, the teacher buvived the toy. During the check, the rope buvived the rope. After the visit, the artist buvived the lock. Tomorrow, the chef will buviv",43,verb_final_subtoken,"[{'animacy': 'animate', 'object': 'toy', 'subject': 'teacher'}, {'animacy': 'inanimate', 'object': 'rope', 'subject': 'rope'}, {'animacy': 'animate', 'object': 'lock', 'subject': 'artist'}]",buviv,3,"In the lab, the teacher buvived the toy. During the check, the rope buvived the rope. After the visit, the artist buvived the lock.",2,"[1081, 40418]","['Ġbu', 'viv']",chef,animate, buviv,"Tomorrow, the chef will buviv",7,nonce|0001|buviv|T+,1,EleutherAI/pythia-1.4b,42,-7.625463008880615,7.625463008880615,7.625463485717773,114.6295166015625,0.06652268727803247
aligned,T+,"In the lab, the door mexived the rope. During the check, the worker mexived the lock. After the visit, the glass mexived the towel. Tomorrow, the driver will mexiv",43,verb_final_subtoken,"[{'animacy': 'inanimate', 'object': 'rope', 'subject': 'door'}, {'animacy': 'animate', 'object': 'lock', 'subject': 'worker'}, {'animacy': 'inanimate', 'object': 'towel', 'subject': 'glass'}]",mexiv,3,"In the lab, the door mexived the rope. During the check, the worker mexived the lock. After the visit, the glass mexived the towel.",2,"[479, 32693]","['Ġme', 'xiv']",driver,animate, mexiv,"Tomorrow, the driver will mexiv",7,nonce|0002|mexiv|T+,2,EleutherAI/pythia-1.4b,42,-6.961472511291504,6.961472511291504,6.961472988128662,118.5982894897461,0.05869792067052152
aligned,T+,"In the lab, the glass dokiped the plate. During the check, the teacher dokiped the toy. After the visit, the rope dokiped the rope. Tomorrow, the box will dokip",43,verb_final_subtoken,"[{'animacy': 'inanimate', 'object': 'plate', 'subject': 'glass'}, {'animacy': 'animate', 'object': 'toy', 'subject': 'teacher'}, {'animacy': 'inanimate', 'object': 'rope', 'subject': 'rope'}]",dokip,3,"In the lab, the glass dokiped the plate. During the check, the teacher dokiped the toy. After the visit, the rope dokiped the rope.",2,"[513, 44821]","['Ġdo', 'kip']",box,inanimate, dokip,"Tomorrow, the box will dokip",7,nonce|0018|dokip|T+,18,EleutherAI/pythia-1.4b,42,-4.663046360015869,4.663046360015869,4.663046360015869,137.62881469726562,0.033881323255401934
aligned,T-,"In the lab, the rope klooluped. During the check, the artist klooluped. After the visit, the door klooluped. During the trial, the student will kloolup",43,verb_final_subtoken,"[{'animacy': 'inanimate', 'object': '', 'subject': 'rope'}, {'animacy': 'animate', 'object': '', 'subject': 'artist'}, {'animacy': 'inanimate', 'object': '', 'subject': 'door'}]",kloolup,3,"In the lab, the rope klooluped. During the check, the artist klooluped. After the visit, the door klooluped.",3,"[27451, 1062, 484]","['Ġkl', 'ool', 'up']",student,animate, kloolup,"During the trial, the student will kloolup",10,nonce|0019|kloolup|T-,19,EleutherAI/pythia-1.4b,42,-0.6265702247619629,0.6265702247619629,0.6265702843666077,158.39630126953125,0.003955712850266746
aligned,T+,"In the lab, the worker negived the vase. During the check, the glass negived the box. After the visit, the teacher negived the cup. During the trial, the paper will negiv",43,verb_final_subtoken,"[{'animacy': 'animate', 'object': 'vase', 'subject': 'worker'}, {'animacy': 'inanimate', 'object': 'box', 'subject': 'glass'}, {'animacy': 'animate', 'object': 'cup', 'subject': 'teacher'}]",negiv,3,"In the lab, the worker negived the vase. During the check, the glass negived the box. After the visit, the teacher negived the cup.",2,"[2297, 400]","['Ġneg', 'iv']",paper,inanimate, negiv,"During the trial, the paper will negiv",9,nonce|0023|negiv|T+,23,EleutherAI/pythia-1.4b,42,-5.612521648406982,5.612521648406982,5.612522125244141,105.70539855957031,0.0530958891572714
